{
  "pair_id": "DB3-0031",
  "domain": "materials",
  "language": "zh",
  "requirement_text": "产品外壳材料要有高级质感、手感温润。",
  "requirement_structured": {
    "property_id": "unmapped",
    "direction": null,
    "target_value": {},
    "rv_hint": null,
    "constraints": [],
    "ambiguity_flags": []
  },
  "rule_ids": [
    "R-NOMAP-000"
  ],
  "info_metric_vector": null,
  "worked_example": null,
  "metric_rationale": [
    "cross domain rl architecture plan.md §2.3.3 R-NOMAP-000：规则库未命中 → UNMAPPED+最近邻规则建议，禁止硬映射，转入人工队列",
    "cross domain rl architecture plan.md §2.3.8 第 5 条（规则覆盖度）：v0 只保证热/扩散、弹性、平衡态统计三类种子领域"
  ],
  "strictness": null,
  "requires_db5_calibration": false,
  "expected_unmapped_output": {
    "flag": "UNMAPPED",
    "nearest_rule_suggestions": [
      "R-ROBUST-001（仅当'质感'实际指耐刮擦/耐磨时才可映射——须先人工确认谓词本意）"
    ],
    "human_queue": true
  },
  "provenance": {
    "source": "AI+drafted",
    "human_review_status": "approved",
    "anchor_eligible": true,
    "review_date": "2026-09-30",
    "reviewer": "reviewer+user"
  },
  "rules_version": "0.2.0",
  "convention_version": "1.0.0"
}