{
  "pair_id": "DB3-0008",
  "domain": "measurement",
  "language": "zh",
  "requirement_text": "测厚仪单次测量的厚度标准差不超过 1 μm。",
  "requirement_structured": {
    "property_id": "precision",
    "direction": "bound_below",
    "target_value": {
      "sigma_m": 1e-06,
      "n_samples_count": 1
    },
    "rv_hint": "iid_samples",
    "constraints": [],
    "ambiguity_flags": []
  },
  "rule_ids": [
    "R-PRECISE-001"
  ],
  "info_metric_vector": {
    "q1_fisher_directional": {
      "direction": "lower_bound",
      "expr": "1/(n · sigma_req^2)",
      "note": "θ=厚度方向"
    }
  },
  "worked_example": {
    "setup": "超声测厚，σ_req=1e-6 m，n=1",
    "given": {
      "sigma_req": {
        "value": 1e-06,
        "unit": "m",
        "is_bridge_constant": true
      },
      "n": {
        "value": 1,
        "unit": "dimensionless_count",
        "is_bridge_constant": false
      }
    },
    "computation": "q1 ≥ 1/(1 × 1e-12)",
    "result": "q1 ≥ 1e12 m^-2",
    "reference_scale": "长度方向 q1 参考尺度：微米级精密测量 1e10–1e14 m^-2"
  },
  "metric_rationale": [
    "cross domain rl architecture plan.md §2.3.3 R-PRECISE-001 [定理]",
    "md/information mechanics derivations.md §1 定理 1.3 Cramér–Rao 下界（约 L73–97）：Cov[θ̂] ⪰ g^{-1}"
  ],
  "strictness": "定理",
  "requires_db5_calibration": false,
  "provenance": {
    "source": "AI+drafted",
    "human_review_status": "approved",
    "anchor_eligible": true,
    "review_date": "2026-09-30",
    "reviewer": "reviewer+user"
  },
  "rules_version": "0.2.0",
  "convention_version": "1.0.0"
}