{
  "pair_id": "DB3-0025",
  "domain": "electronics",
  "language": "zh",
  "requirement_text": "自适应均衡器要覆盖 16 种信道状态，且参数后验保持平坦（宽容度大）。",
  "requirement_structured": {
    "property_id": "adaptability",
    "direction": "bound_below",
    "target_value": {
      "n_environments_count": 16
    },
    "rv_hint": "environment_channel",
    "constraints": [],
    "ambiguity_flags": []
  },
  "rule_ids": [
    "R-ADAPT-001"
  ],
  "info_metric_vector": {
    "q5_channel_capacity": {
      "direction": "lower_bound",
      "expr": "ln(M)"
    },
    "q2_posterior_sharpness": {
      "direction": "upper_bound",
      "expr": "0（det g ≤ 1）"
    }
  },
  "worked_example": {
    "setup": "通信自适应均衡，M=16",
    "given": {
      "M": {
        "value": 16,
        "unit": "dimensionless_count",
        "is_bridge_constant": false
      },
      "C_req": {
        "value": 2.77,
        "unit": "nats",
        "is_bridge_constant": true
      }
    },
    "computation": "C_req = ln 16 = 2.77 nats",
    "result": "q5 ≥ 2.77 nats；q2 ≤ 0",
    "reference_scale": "q5 参考尺度：信道自适应 2–6 nats"
  },
  "metric_rationale": [
    "cross domain rl architecture plan.md §2.3.3 R-ADAPT-001 [类比]",
    "md/ai to physical.md 对应二：信道容量的双下降定理（容量-自由度关系）",
    "md/Cover_Thomas_入门总结.md 第五章 信道容量（分辨 M 态需 ln M）"
  ],
  "strictness": "类比",
  "requires_db5_calibration": false,
  "provenance": {
    "source": "AI+drafted",
    "human_review_status": "approved",
    "anchor_eligible": true,
    "review_date": "2026-09-30",
    "reviewer": "reviewer+user"
  },
  "rules_version": "0.2.0",
  "convention_version": "1.0.0"
}