{
  "pair_id": "DB3-0011",
  "domain": "thermal",
  "language": "zh",
  "requirement_text": "炉温受扰动后须在 30 s 内回到设定值的 ±1% 带内。",
  "requirement_structured": {
    "property_id": "response_speed",
    "direction": "bound_below",
    "target_value": {
      "settling_time_s": 30,
      "settling_band": "pm_1_percent"
    },
    "rv_hint": "markov_chain",
    "constraints": [
      "disturbance_amplitude = 5 percent"
    ],
    "ambiguity_flags": []
  },
  "rule_ids": [
    "R-FAST-001"
  ],
  "info_metric_vector": {
    "q9_spectral_gap": {
      "direction": "lower_bound",
      "expr": "ln(100)/t_settle ≈ 4.6/t_settle（±1% 带内 ≈ 4.6τ）"
    }
  },
  "worked_example": {
    "setup": "电炉热系统，±1% 回带时间 30 s",
    "given": {
      "t_settle": {
        "value": 30,
        "unit": "s",
        "is_bridge_constant": true
      }
    },
    "computation": "τ ≈ t_settle/ln(100) = 30/4.6 = 6.5 s；q9 ≥ 4.6/30",
    "result": "q9 ≥ 0.154 s^-1",
    "reference_scale": "q9 参考尺度：热系统 1e-2–1 s^-1"
  },
  "metric_rationale": [
    "cross domain rl architecture plan.md §2.3.3 R-FAST-001 [定理，马尔可夫系统]、§2.3.5 例 3（OU 过程：λ2=θ=MI 衰减速率）",
    "md/information mechanics derivations.md B.7 稳定性分析（弛豫与谱）"
  ],
  "strictness": "定理（马尔可夫系统）",
  "requires_db5_calibration": false,
  "provenance": {
    "source": "AI+drafted",
    "human_review_status": "approved",
    "anchor_eligible": true,
    "review_date": "2026-09-30",
    "reviewer": "reviewer+user"
  },
  "rules_version": "0.2.0",
  "convention_version": "1.0.0"
}